{
  "schema_id": "urn:autoeditor:schema:registry:1",
  "contract_id": "autoeditor-2034-contract/1",
  "registry_version": 1,
  "schemas": [
    {
      "id": "urn:autoeditor:schema:archive-manifest:1",
      "path": "schemas/archive-manifest-1.schema.json",
      "sha256": "70627e95120c3abe0127af5a82731e940c7b64389ee3edaed4506324ad7232b6",
      "status": "current",
      "kind": "archive"
    },
    {
      "id": "urn:autoeditor:schema:edit-intent:1",
      "path": "schemas/edit-intent-1.schema.json",
      "sha256": "1998bce0e069c104168b918744f287c7b10cf8aa975d561abdc41bd06411e848",
      "status": "current",
      "kind": "adapter"
    },
    {
      "id": "urn:autoeditor:schema:planner-proposal:1",
      "path": "schemas/planner-proposal-1.schema.json",
      "sha256": "60d92750a3e9f27d7564285ad4a02f808671b108775a9c274e6dc1c9f9d563e7",
      "status": "current",
      "kind": "adapter"
    },
    {
      "id": "urn:autoeditor:schema:receipt-envelope:1",
      "path": "schemas/receipt-envelope-1.schema.json",
      "sha256": "332c456ca44fd1edadce025bf4f22e30ca12fa546f6ce42c5f04b4f2333546ef",
      "status": "current",
      "kind": "evidence"
    },
    {
      "id": "urn:autoeditor:schema:registry:1",
      "path": "schemas/registry-1.schema.json",
      "sha256": "9461b903d3cd4c74874eee5aef5fe02b6b562d96f0355a94a6d047d11e18da98",
      "status": "current",
      "kind": "registry"
    },
    {
      "id": "urn:autoeditor:schema:render-request:1",
      "path": "schemas/render-request-1.schema.json",
      "sha256": "0caae5aa4723d82d67f00e4061079ab07a5af4430a84297e0cdb24d7bd5e6580",
      "status": "current",
      "kind": "adapter"
    }
  ],
  "legacy_schema_ids": [
    "autoeditor-approved-plan/v1",
    "autoeditor-artifact-frame-capture-coverage/v1",
    "autoeditor-artifact-review/v1",
    "autoeditor-artifact-review/v2",
    "autoeditor-artifact-vision-coverage/v2",
    "autoeditor-artifact-vision-plan/v2",
    "autoeditor-asr-runtime-probe/v1",
    "autoeditor-audio-mix-receipt/v1",
    "autoeditor-calibrated-semantic-artifact-review/v1",
    "autoeditor-calibrated-semantic-choice-attempt-binding/v1",
    "autoeditor-calibrated-semantic-choice-invocation/v1",
    "autoeditor-calibrated-semantic-choice-observation/v1",
    "autoeditor-calibrated-semantic-choice-plan/v1",
    "autoeditor-calibrated-semantic-choice-receipt/v1",
    "autoeditor-calibrated-semantic-choice/v1",
    "autoeditor-calibrated-semantic-promotion-gate/v1",
    "autoeditor-caption-render-receipt/v1",
    "autoeditor-caption-vision-sampling/v1",
    "autoeditor-chat/v1",
    "autoeditor-corresponding-source-bundle/v1",
    "autoeditor-corresponding-source-policy/v1",
    "autoeditor-creative-constraints/v1",
    "autoeditor-cut-vision-sampling/v1",
    "autoeditor-decoded-frame-timeline-receipt/v1",
    "autoeditor-desktop-audio-qa/v1",
    "autoeditor-deterministic-musical-pcm/v1",
    "autoeditor-deterministic-pcm/v1",
    "autoeditor-dialogue-cleanup-runtime-probe/v1",
    "autoeditor-edit-boundaries/v1",
    "autoeditor-edit-policy-request/v1",
    "autoeditor-edit-policy/v1",
    "autoeditor-electron-chromium-provenance-lock/v1",
    "autoeditor-electron-chromium-provenance/v1",
    "autoeditor-electron-native-producer-receipt/v1",
    "autoeditor-engine-artifact-contract/v2",
    "autoeditor-engine-artifact-contract/v3",
    "autoeditor-engine-artifact-contract/v4",
    "autoeditor-engine-artifact-contract/v5",
    "autoeditor-engine-caption-render-self-test/v1",
    "autoeditor-engine-qa/v2",
    "autoeditor-explicit-pairwise-preference/v1",
    "autoeditor-ffmpeg-rgb24-decoder-receipt/v1",
    "autoeditor-final-vision-qa/v6",
    "autoeditor-final-vision-qa/v7",
    "autoeditor-fixed-music-probe-proposal/v1",
    "autoeditor-fixed-project-generated-music-authorization/v1",
    "autoeditor-fixed-project-generated-music-probe/v1",
    "autoeditor-fixed-project-generated-sfx-authorization/v1",
    "autoeditor-fixed-project-generated-sfx-probe/v1",
    "autoeditor-fixed-sfx-probe-proposal/v1",
    "autoeditor-helper-candidate/v2",
    "autoeditor-helper-github-assets/v1",
    "autoeditor-helper-release/v2",
    "autoeditor-helper-runtime/v1",
    "autoeditor-local-media-analysis/v4",
    "autoeditor-local-runtime-probe/v1",
    "autoeditor-local-vision-model-pack/v1",
    "autoeditor-local-vision-runtime/v2",
    "autoeditor-local-vision-worker-runtime/v1",
    "autoeditor-macos-ffmpeg-bundle/v1",
    "autoeditor-macos-ffmpeg-whole-macho/v1",
    "autoeditor-macos-homebrew-ffmpeg-source-evidence/v1",
    "autoeditor-macos-homebrew-ffmpeg-sources/v1",
    "autoeditor-macos-remotion-producer/v1",
    "autoeditor-music-asset-manifest/v1",
    "autoeditor-music-audio-qa/v1",
    "autoeditor-music-compile-receipt/v1",
    "autoeditor-music-generation-evidence/v1",
    "autoeditor-music-output-timeline/v1",
    "autoeditor-music-plan/v1",
    "autoeditor-music-production-receipt/v1",
    "autoeditor-music-production-self-test/v1",
    "autoeditor-music-render-receipt/v2",
    "autoeditor-music-source-analysis/v1",
    "autoeditor-music-speech-evidence/v1",
    "autoeditor-music-two-pass-loudnorm/v1",
    "autoeditor-native-media-allowlist/v1",
    "autoeditor-native-media-receipt/v1",
    "autoeditor-native-media-sources/v1",
    "autoeditor-onnxruntime-node-target-prune/v2",
    "autoeditor-preference-journal/v1",
    "autoeditor-production-deterministic-visual-qa/v1",
    "autoeditor-production-visual-timeline-intent/v1",
    "autoeditor-project-intent-authority/v2",
    "autoeditor-project-intent-engine-envelope/v2",
    "autoeditor-project-intent-render-receipt/v2",
    "autoeditor-project-intent/v1",
    "autoeditor-pyinstaller-symlink-normalization/v1",
    "autoeditor-remotion-npm-source/v1",
    "autoeditor-remotion-windows-runtime-prune/v1",
    "autoeditor-render-capability-fixture/v1",
    "autoeditor-render-capability-runtime-probe/v1",
    "autoeditor-rgb24-technical-evidence/v1",
    "autoeditor-runtime-capability-check-result-receipt/v1",
    "autoeditor-runtime-capability-compact/v1",
    "autoeditor-runtime-capability-detailed/v1",
    "autoeditor-runtime-capability-fixed-check-runner/v1",
    "autoeditor-runtime-capability-probe-receipt/v1",
    "autoeditor-semantic-artifact-coverage/v1",
    "autoeditor-semantic-artifact-target/v1",
    "autoeditor-semantic-visual-blocked-report/v1",
    "autoeditor-semantic-visual-corpus-binding/v1",
    "autoeditor-semantic-visual-hardware-inventory/v1",
    "autoeditor-semantic-visual-label-record/v1",
    "autoeditor-semantic-visual-qualification-manifest/v1",
    "autoeditor-semantic-visual-qualification-result/v1",
    "autoeditor-semantic-visual-qualification-run/v1",
    "autoeditor-semantic-visual-split-report/v1",
    "autoeditor-semantic-visual-training-workspace/v1",
    "autoeditor-sequence-compile-receipt/v1",
    "autoeditor-sequence-handoff-receipt/v1",
    "autoeditor-sequence-handoff-receipt/v2",
    "autoeditor-sequence-plan/v1",
    "autoeditor-sequence-render-timing-receipt/v2",
    "autoeditor-sequence-render/v5",
    "autoeditor-sfx-anchor-evidence/v1",
    "autoeditor-sfx-compile-receipt/v1",
    "autoeditor-sfx-cue-manifest/v1",
    "autoeditor-sfx-generation-evidence/v1",
    "autoeditor-sfx-output-timeline/v1",
    "autoeditor-sfx-plan/v1",
    "autoeditor-sfx-production-receipt/v1",
    "autoeditor-sfx-production-self-test/v1",
    "autoeditor-sfx-render-receipt/v1",
    "autoeditor-sfx-speech-evidence/v1",
    "autoeditor-source-catalog/v1",
    "autoeditor-source-manifest/v1",
    "autoeditor-source-render-manifest/v4",
    "autoeditor-source-timed-words/v1",
    "autoeditor-stale-vision-benchmark-cleanup/v1",
    "autoeditor-story-acceptance/v1",
    "autoeditor-story-cut-receipt/v1",
    "autoeditor-story-edit/v1",
    "autoeditor-team-handoff-hash-receipt/v1",
    "autoeditor-team-portable-identity/v1",
    "autoeditor-transition-artifact-receipt/v1",
    "autoeditor-transition-compile-receipt/v1",
    "autoeditor-transition-decisions/v1",
    "autoeditor-transition-plan/v1",
    "autoeditor-transition-render-public-receipt/v1",
    "autoeditor-transition-render-receipt/v1",
    "autoeditor-transition-render/v1",
    "autoeditor-transition-sequence-manifest/v1",
    "autoeditor-trusted-capability-manifest/v1",
    "autoeditor-vision-epipe-smoke/v1",
    "autoeditor-visual-quality-deterministic-receipt/v1",
    "autoeditor-visual-quality-deterministic-request/v1",
    "autoeditor-visual-quality-deterministic-result/v1",
    "autoeditor-visual-quality-electron-probe/v1",
    "autoeditor-visual-quality-fixtures/v1",
    "autoeditor-windows-ffmpeg-build/v4",
    "autoeditor-windows-ffmpeg-capabilities/v1",
    "autoeditor-windows-ffmpeg-linkage/v2",
    "autoeditor-windows-ffmpeg-sources/v3",
    "pse-creative-edl/2026-08-12.3"
  ],
  "identifier_namespaces": {
    "capability_id": "urn:autoeditor:capability:",
    "check_id": "urn:autoeditor:check:",
    "algorithm_id": "urn:autoeditor:algorithm:",
    "payload_schema_id": "urn:autoeditor:schema:",
    "policy_id": "urn:autoeditor:policy:",
    "artifact_contract_id": "urn:autoeditor:artifact-contract:"
  },
  "retired_ambiguous_capabilities": {
    "visual_quality_analysis": [
      "urn:autoeditor:capability:deterministic.visual.rgb24",
      "urn:autoeditor:capability:semantic.visual.calibrated"
    ]
  }
}
